id,title,author,genre,description,rating,date,completed,age,free,link
799524,절대복종,혼,"스토리, 액션","일진들의 괴롭힘을 받던 다임은 자신의 오래된 핸드폰에서 자신의 인생을 바꿀 게임을 만나게 된다.일진들을 부려먹고, 선량한 조력자들을 포섭하여 성장시킬 수 있는 사기적인 전략 RPG 게임!이 RPG 게임의 최종 목표는 학교 폭력을 세상에서 없애는 것이다.",8.36,2022.12.29 22:56,FALSE,15세 이용가,FALSE,https://comic.naver.com/webtoon/list?titleId=799524
697655,절벽귀,오성대,"스토리, 스릴러",아무도 없는 절벽 한가운데 고립된 두 남자.절벽 끝에서 펼쳐지는 숨막히는 이야기,9.97,2017.08.07 23:01,TRUE,15세 이용가,TRUE,https://comic.naver.com/webtoon/list?titleId=697655
703833,점핑오버,조니조 / 서사야,"스토리, 로맨스",평범하고픈 소녀 연희와하늘에서 떨어진 소년 이안의 특별한 이야기!,9.94,2020.04.04 23:22,TRUE,전체연령가,TRUE,https://comic.naver.com/webtoon/list?titleId=703833
762279,정글쥬스,형은 / 쥬더,"스토리, 액션","의문의 벌레약 ‘정글쥬스’로 인해 곤충인간이 되었다.이를 숨기며 살던 대학생 장수찬은 어느 날 그 모습을모두에게 보이게 되고, 곤충인간들의 사회로 들어가약육강식의 논리와 맞서 싸우게 되는데...각양각색 곤충능력자들의 판타지 액션슈퍼스트링 유니버스의 새로운 히어로 등장!",9.94,2022.08.10 23:00,TRUE,15세 이용가,FALSE,https://comic.naver.com/webtoon/list?titleId=762279
726214,정년이,서이레 / 나몬,"스토리, 드라마","가진 것 없고 배운 것 없지만, 소리 하나만큼은 타고난 목포 소녀 정년! 정년의 꿈은 여성 국극단에 들어가 부자가 되는 것인데… 배워야 할 것은 많고, 주연 배우 자리는 멀기만 하다. 과연 정년은 대 스타가, 부자가 될 수 있을까?",9.97,2022.05.16 23:00,TRUE,전체연령가,TRUE,https://comic.naver.com/webtoon/list?titleId=726214
733078,정보전사 202,이작가,"스토리, 액션",간첩 202호! 작전명 한라혈통!관종의 임무를 완수하고 자유를 얻어라.,9.3,2021.05.02 23:08,TRUE,12세 이용가,TRUE,https://comic.naver.com/webtoon/list?titleId=733078
731978,정순애 식당,아르몽,"스토리, 드라마","미각을 잃은 사람도 이곳에 오면 ""맛있다""를 외칩니다!!따뜻한 집밥과 사람 사는 냄새가 나는 힐링공간 정순애식당에 어서오세요~",9.98,2021.03.30 23:28,TRUE,전체연령가,TRUE,https://comic.naver.com/webtoon/list?titleId=731978
798296,제 3 아파트,오닛,"스토리, 스릴러","""이웃들이 수상하다""이웃간의 정을 중요시 하는 제 3 아파트.친목질을 강요하지만 주인공 가족은 거부하고, 그 후 이웃들은 숨통을 조여오기 시작한다.",9.04,2022.12.25 10:16,FALSE,15세 이용가,TRUE,https://comic.naver.com/webtoon/list?titleId=798296
772004,제7원,남정훈 / 김태헌,"스토리, 스릴러",‘낯 선 감방에서 눈을 뜬 남자 4310. 그는 자신이 기억을 잃었다는 것과 아울러 이 감방엔 문이 없는 사방이 벽뿐이라는 사실을 알게 된다!’,9.59,2021.06.14 10:00,TRUE,,TRUE,https://comic.naver.com/webtoon/list?titleId=772004
25714,제로,정재한 / 이나루,"스토리, 드라마","늘 행복한 길만 걸어가라고 지어 준 이름 제로(禔路)
세상에 남은 그의 유일한 행복, 서연.그는 잃어버린 그녀의 혼을 찾아 떠난다..",9.77,2008.05.30 00:00,TRUE,12세 이용가,FALSE,https://comic.naver.com/webtoon/list?titleId=25714
676695,제로게임,즐바센,"스토리, 판타지",죽음을 선택한 사람들의 인생 재건설 서바이벌!2015 대학만화 최강자전 수상작,9.97,2022.12.26 22:57,FALSE,12세 이용가,FALSE,https://comic.naver.com/webtoon/list?titleId=676695
783535,제왕: 빛과 그림자,"김남규 / 애풍,KONAM","스토리, 액션","한국판 '삼합회' 대동그룹 회장 권수찬, 특수부 부장검사 유석호, 국회의원 김남훈이 세 사람은 어릴 적부터 늘 함께였던 죽마고우이다.어른이 되어서도 끈끈한 우정을 이어간 이 세 친구는 서로 밀어주고 당겨주며 함께 성장해 나간다. 하지만 수찬의 대동그룹이 대형 비리 사건에 연루되면서 세 사람의 긴밀한 커넥션은 위기에 처한다. 급기야 사건의 중심인 수찬은 검찰의 수사를 피하기 위해 중국으로 도피를 하고...한편 수찬과 오랜 원수 관계이자 라이벌 조직의 보스 오정만은 수찬을 위기에 처한 틈을 놓치지 않고 수찬을 제거하기 위해 은밀히 히트맨들을 고용해 중국에 보내는데...",9.9,2022.12.25 22:56,FALSE,전체연령가,FALSE,https://comic.naver.com/webtoon/list?titleId=783535
773067,제타,하지,"스토리, 스릴러",극심한 슬럼프에 안드로이드 '제타'의 그림을 표절해버린 금세기 최고의 천재 화가 '최후람'.그 사실을 숨기려는 최후람과 파헤치려는 제타의 피튀기는 4주 간의 미술제가 시작된다!인간 이하의 인간과 인간 이상의 안드로이드가 보여주는 아이러니. 과연 최후의 승자는 누가 될 것인가?,9.82,2022.09.24 22:59,TRUE,12세 이용가,FALSE,https://comic.naver.com/webtoon/list?titleId=773067
440244,제페토,연제원,"스토리, 판타지","제페토 박사가 죽기 전에 남겼다는 제페토의 유산.지배를 위해, 생존을 위해, 사랑을 위해, 제페토의 유산을 손에 넣기 위한 대립이 시작된다!'흐드러지다' 연제원 작가의 SF 신작 <제페토>",9.95,2015.06.03 23:13,TRUE,12세 이용가,TRUE,https://comic.naver.com/webtoon/list?titleId=440244
652466,조석축구만화,조석,"에피소드, 스포츠",조석 작가가 들려주는 너무나도 솔직담백한 해외축구이야기.,9.81,2015.08.11 13:23,TRUE,전체연령가,FALSE,https://comic.naver.com/webtoon/list?titleId=652466
748410,조선방랑야사,가현,"스토리, 무협/사극","한때 조선 한양 책방에서 연애담 소설로 최고 인기를 구가하던 선비 성기임.수험 압박 탓인지 새로운 신예 ‘방랑 서자’에 밀려, 고전을 면치 못하고 있다.하루라도 빨리 옛 명성을 되찾겠다는 결심으로 ‘실생활 밀접형’ 소재를 찾기 위해직접 저잣거리로 나서게 되는데, 과연 성 선비는 목적을 달성할 수 있을까…?",9.9,2020.06.29 10:00,TRUE,15세 이용가,TRUE,https://comic.naver.com/webtoon/list?titleId=748410
758676,조선여우스캔들,문종호 / 정후 / 차소희,"스토리, 로맨스","우리가 아는 전래동화는 사실 하늘에서 도망친 신수들이 벌인 범죄극이다!하늘에서 어사로 파견된 여우 시호. 조선 최고의 기생이자 사기꾼 초란.재주도 많고 사연도 많은 이들이 도깨비들의 수장 담과 함께인간들을 괴롭히는 악한 신수들을 쫓아, 전래동화 속 이야기를 유쾌하게 뒤집고,하늘마저 눈물을 흘릴 애틋한 사랑도 함께 시작한다. 바로 지금!",9.93,2022.12.24 22:57,FALSE,전체연령가,FALSE,https://comic.naver.com/webtoon/list?titleId=758676
642598,조선왕조실톡,무적핑크,"에피소드, 개그","어느 날 메신저로 찾아온, 조선 시대 그분들의 시시콜콜한 이야기.무적핑크 작가 신작!",9.89,2018.11.17 23:25,TRUE,전체연령가,FALSE,https://comic.naver.com/webtoon/list?titleId=642598
509094,조선좀비실록,곤마,"스토리, 판타지","알 수 없는 역병으로 사람들이 좀비로 변해버린 조선,그 역병을 멈출 수 있는 사람은 오직 그녀 뿐! 목숨 걸고 그녀를 지켜야 한다!",9.85,2018.01.18 23:23,TRUE,12세 이용가,FALSE,https://comic.naver.com/webtoon/list?titleId=509094
737019,조선홍보대행사 조대박,김양수,"스토리, 개그",냉혈한 광고홍보의 귀재조선 시장에서도 성공할 수 있을까?,9.9,2021.11.01 22:58,TRUE,전체연령가,TRUE,https://comic.naver.com/webtoon/list?titleId=737019
697656,조의 영역,조석,"스토리, 스릴러",물에 살던 녀석들의 모습이 상식을 벗어나기 시작했다.'마음의 소리' 조석의 재난 스릴러,9.94,2019.06.22 23:08,TRUE,12세 이용가,TRUE,https://comic.naver.com/webtoon/list?titleId=697656
774862,조조코믹스,이동건,"옴니버스, 로맨스",말 실수하면 모조리 처형한다!위험한 팀장 조쉬가 벌이는 기상천외한 오피스 사형법.‘근데 이 사형법…. 어쩐지 설레는데?’조쉬의 기이한 행동이 불러오는 로맨스.<조조코믹스>의 두 번째 이야기!,9.97,2022.10.11 23:00,TRUE,전체연령가,FALSE,https://comic.naver.com/webtoon/list?titleId=774862
783051,존망코인,박태준 만화회사,"스토리, 스릴러","“코인 떡상으로 인생역전, 한번쯤은 상상해봤잖아?”인생을 포기하고 사채를 빌려 처음이자 마지막 사치를 즐기던 흙수저 ‘박의진’과 ‘고준형’그러나 죽음을 받아들이기 직전, 장난삼아 구매한 암호화폐 ‘존망코인’이 알 수 없는 이유로 폭등하기 시작하고 둘의 운명을 바꿔버리기 시작하는데..",9.27,2022.08.13 22:59,TRUE,15세 이용가,FALSE,https://comic.naver.com/webtoon/list?titleId=783051
774864,존잘주의,령,"스토리, 로맨스",외모로 고통받던 나에게 악마가 나타나 매력적인 제안을 한다!클릭 한번으로 내가 원하는 외모로 만들 수 있다고?CUTE SEXY PURE LUXURY! 스탯을 올려 원하는 외모를 만들라고?!그런데 있잖아..예뻐지기만 하면 행복해질 줄 알았는데...그게 아닌걸까?,9.53,2022.12.30 22:57,FALSE,15세 이용가,FALSE,https://comic.naver.com/webtoon/list?titleId=774864
796062,좀간,옹구 / 다이,"스토리, 액션","모두가 살기 위해 발버둥 치는 세상 속, 유일하게 죽음을 원하는 소년, 온미래.어느날 그의 앞에 필살부대가 나타나 제안을 건넨다. '너를 죽여줄테니, 인간 사회를 함께 재건해다오'죽기 위해선, 모두를 살려야 한다.",9.95,2022.12.27 22:50,FALSE,15세 이용가,FALSE,https://comic.naver.com/webtoon/list?titleId=796062
765157,좀비 파이트,이저녁,"스토리, 액션","이안은 삶이 힘들어질수록 감정을 끄며 버텨낸다.아버지의 폭력과 빚더미 뿐인 집안... 불행은 계속되었고 그의 신체는 점점 무감각해졌다.통증까지 무감각해진 이안은 우연히 불법 격투 현장을 지나가다 제안을 받는다.""경기에 참가하면, 이 바닥에 있는 돈 전부 줄게.""불법 격투 경기장에서 살아남아야만 하는 그의 생존기가 시작된다!",9.96,2022.11.25 23:00,TRUE,15세 이용가,FALSE,https://comic.naver.com/webtoon/list?titleId=765157
715772,좀비딸,이윤창,"스토리, 드라마",나의 딸은 좀비다.이 세상 마지막 남은 유일한 좀비...,9.97,2022.03.26 22:00,TRUE,전체연령가,TRUE,https://comic.naver.com/webtoon/list?titleId=715772
423392,좀비를 위한 나라는 없다,모래인간,"스토리, 판타지","좀비 백신이 만들어진 후, 치료된 사람들은 자신이 좀비였을 적의 기억때문에 괴로워한다.인간과 좀비 사이. 엔딩크레딧 그 이후의 이야기, '좀비를 위한 나라는 없다'",9.94,2014.02.07 23:06,TRUE,18세 이용가,TRUE,https://comic.naver.com/webtoon/list?titleId=423392
748411,좀비소녀,DAMA,"스토리, 액션","어릴 적 화재와 화상 흉터로 한없이 움추러드는 사춘기 소녀 원나.그런 그녀에게 닥친 생애 최초, 최고의 상황 ㅡ 좀비바이러스.좀비바이러스에 전염된 마을 어르신들을 지킬 수 있는 건, 오직 원나뿐!힐링감 넘치는 원나의 웃픈 성장기 <좀비소녀>를 소개합니다!",9.89,2020.06.29 10:00,TRUE,전체연령가,TRUE,https://comic.naver.com/webtoon/list?titleId=748411
784819,좋아하게 될 거야,박수정(방울마마) / 이굴림,"스토리, 로맨스","""빤스를 노려.""같은 과 선배, 강윤석을 오랫동안 짝사랑하고 있는 스물세 살 대학생, 윤지민.용하다는 무당을 찾아가 그의 마음을 훔칠 수 있는 부적을 써 오는데, 글쎄 반드시 그의 속옷에다 숨겨야만 한다지 뭔가!",9.62,2022.12.24 22:00,FALSE,전체연령가,TRUE,https://comic.naver.com/webtoon/list?titleId=784819
750572,좋아하게 해줘,지원 / 예림,"스토리, 로맨스",99번 차였지만 포기할 수 없어!,9.78,2020.08.10 00:00,TRUE,전체연령가,TRUE,https://comic.naver.com/webtoon/list?titleId=750572
699659,좋아하는 부분,타리,"스토리, 로맨스",극한의 남자취향을 가진 여인 소우주의 고군분투 로맨스,9.94,2019.10.02 23:20,TRUE,12세 이용가,TRUE,https://comic.naver.com/webtoon/list?titleId=699659
786882,좋아해 아니 싫어해,지지,"스토리, 로맨스","이제 막 군대를 전역해 복학을 하게 된 김 민.부푼 기대감을 안고 들어간 첫 수업에서 이유도 없이 이별을 고해 트라우마를 안겼던'보라'를 만나게 된다. 아무 일도 없었다는 듯이 그의 앞에 나타나 뻔뻔하게 행동하는그녀를 보며 화도 나지만 미묘한 설렘 또한 감출 수 없는 민,'좋아해... 아니 싫어해...'아직은 모든 것이 미숙한 민이의 성장 캠퍼스 로맨스.",9.38,2022.12.30 22:58,FALSE,15세 이용가,FALSE,https://comic.naver.com/webtoon/list?titleId=786882
764951,좋은데 어떡해,여은,"스토리, 로맨스","맘에 드는 사람이 생기면 일단 표현하고 직진하는 탓에짝남, 썸남에게 전부 차이기만 하고 연애를 좀처럼 시작할 수가 없는 정연우.그런데 갑자기 연우에게 남자들이 다가온다...?!중학교 동창 서지완, 같은 과 동기 권우주, 동아리 선배 강하경까지! 이번엔 연애를 시작할 수 있을까?",9.9,2022.09.23 23:01,TRUE,전체연령가,FALSE,https://comic.naver.com/webtoon/list?titleId=764951
794210,죄송한데 주인공이세요?,조석,"스토리, 개그","꼴찌 성적의 로맨스물을 연재 중인 웹툰 작가 정은하. 인기 있는 만화를 그리고 싶다는 염원을 담아 연필을 집어든 은하는 본인의 만화 속에서 깨어나게 되고기왕 만화 속으로 들어온 거, 내용을 전부 뜯어고쳐서 인기 순위권에 들려 하는데..그렇다면 가장 먼저 해야 할 일은.. 로맨스가 일어나지 않도록 남주를 죽이는 것?!""이 만화는 오늘부터 학원 폭력물로 장르를 바꾼다!!""",9.95,2022.11.02 22:51,TRUE,전체연령가,FALSE,https://comic.naver.com/webtoon/list?titleId=794210
592721,죄의 파편,이승찬,"스토리, 스릴러","다섯 명의 사람, 다섯 개의 폭탄그리고 단 하나의 죄",9.95,2014.05.16 23:09,TRUE,15세 이용가,FALSE,https://comic.naver.com/webtoon/list?titleId=592721
769567,"주님, 악마가 되게 해주세...",불사 / 용가리,"스토리, 개그","생활고의 마녀로 불리는 소녀, 백모란.사실 그녀의 정체는 벌을 받아 인간으로 태어난 전직 악마다.몇 번의 생을 되풀이해도 인간으로 태어나는 윤회의 굴레에서 벗어나고자 이번 생에는 전생들과는 다르게 착하고 인간다운 삶을 살고자 한다.하지만 본성은 악하고, 세상은 그녀를 착하게 내버려두지 않는다. 과연 모란은 이번 생에 다시 악마로 돌아갈 수 있을까?",9.96,2022.08.04 22:58,TRUE,전체연령가,TRUE,https://comic.naver.com/webtoon/list?titleId=769567
793388,주부 육성중,임현,"스토리, 드라마","최강 소방관의 다음 직업은 최강 주부?사랑하는 배우자를 위해 주부가 되기로 한 남자와, 그를 주부로 만들기 위한 마음빌라 사람들의 고군분투 주부 육성기!",9.97,2022.12.27 22:53,FALSE,전체연령가,FALSE,https://comic.naver.com/webtoon/list?titleId=793388
774300,주욱 같은 하루,미티 / 민영,"스토리, 드라마","구남친과 절친의 배신에도 악착같이 인생을 살아온 '오내리'어느 날부터 매일 밤 12시가 지나면 아무도 그녀의 하루를 기억하지 못한다.하지만 1000일이 지난 끝에 그녀의 어제를 기억하는 웹툰작가 '지금일'이 나타나고,그녀는 쓰레기 같은 구남친 '현재승'에게 웹툰으로 복수하기로 하는데..",9.8,2022.09.23 22:59,TRUE,15세 이용가,FALSE,https://comic.naver.com/webtoon/list?titleId=774300
794105,주인님을 잡아먹는 방법,세인 / 차혜영,"스토리, 로맨스","라운 왕국의 뛰어난 기사, 엘 루이즈 테레즈. 그녀는 어느 파티에서 약혼자의 바람을 목격하고 파혼을 선언한다. 파혼에 대한 충격으로 깊은 슬픔에 잠긴 나머지 정신을 잃고 쓰러진 엘. 그리고 다음 날 아침, 엘은 뜻밖의 인물을 마주한다. 바로 미친개로 유명한 개또라이 왕족 테오도르를! 그런데 그 테오도르가 왠지 내 앞에서는 과하게 예의가 바르다?!",9.97,2022.12.26 22:56,FALSE,15세 이용가,FALSE,https://comic.naver.com/webtoon/list?titleId=794105
802854,주작연애,우까,"스토리, 로맨스","""야야 저기 니 여친 지나간다ㅋㅋ""""뭐?죽을래?""공부말고는 잘하는 것 하나 없는 이세경. 같은 학교 아이들에게 늘 저런식으로 괴롭힘 당한다.그런 그녀가 학교만 나가면 인싸녀 그 자체?!학교와의 정반대의 모습에 모두가 알아보지 못하고 심지어 성인 남자들도 그녀가 고딩인줄 모르고 세경에게 만나달라고 애걸복걸하는데.사람들을 속이며 재미 좀 보려는데 뭐야, 저건?하필 걸려도 같은 반의 앙숙인, 하선우한테 정체를 들키는데?!어른도 아닌, 그렇다고 아이도 아닌 청소년들의 방황,사랑,청춘.달콤매콤 톡톡쏘는 사춘기 로맨스가 시작된다!",9.71,2022.12.25 22:30,FALSE,15세 이용가,FALSE,https://comic.naver.com/webtoon/list?titleId=802854
804158,죽어도 다시 한번!,이지원 / 티키타카 / 강하다,"스토리, 로맨스","예쁜 연인이던 은수와 원오는 3년간의 결혼 생활 후 남보다 못한 원수지간으로 갈라선다.이혼 후 2년 뒤, 미국에서 사업에 크게 성공한 원오는 한국으로 돌아와 은수와 재회하지만, 은수의 곁은 그녀를 줄곧 짝사랑해온 태인이 지키고 있다.2년만에 셋이서 재회하게 된 그날 밤, 셋은 같은 와인을 마시고 5년 전 과거로 회귀하게 된다.은수의 완강한 의지로 은수와 원오는 다시 이혼을 준비하고, 태인은 다시 은수를 빼앗길 수 없다는 불안감에 원오와 대립하게 된다.하지만 다시 얼굴을 부딪히고 살게 된 은수와 원오는 과거에 몰랐던 서로의 모습들을 알아가며 흔들리는데.",9.94,2022.12.29 22:00,FALSE,전체연령가,TRUE,https://comic.naver.com/webtoon/list?titleId=804158
759094,죽어도 로맨스,권혜민 / 단염,"스토리, 로맨스",귀신을 보는 장의사 오안나와 좀비가 되어버린 우주 대스타 류빈의 오싹달콤한 로맨스가 시작된다!,9.8,2020.12.14 00:00,TRUE,전체연령가,TRUE,https://comic.naver.com/webtoon/list?titleId=759094
744313,죽여주는 탐정님,뻥 / 조은,"스토리, 스릴러","타인의 거짓말을 꿰뚫어보는 고교생 백아. 거짓으로 사건을 만들어내는 탐정을 만나고, 세상에 그의 진실을 밝혀내야 한다.",9.9,2021.06.05 23:11,TRUE,12세 이용가,TRUE,https://comic.naver.com/webtoon/list?titleId=744313
409629,죽은 마법사의 도시,김칸비_팀 겟네임,"스토리, 판타지","스마트폰엔 마법어플, 택배는 텔레포트로 한방에.마법화된 2030년 근미래도시에서 펼쳐지는 한 연쇄살인마와 그를 추적하는 사람들!'우월한하루', '멜로홀릭'의 팀 겟네임 작가가 선보이는 SF판타지 수사극.",9.95,2016.10.17 23:10,TRUE,12세 이용가,TRUE,https://comic.naver.com/webtoon/list?titleId=409629
703845,죽음에 관하여,시니 / 혀노,"옴니버스, 드라마","삶과 죽음의 경계선, 그 곳엔 누가 있을까? ""가는 길에 심심한데 네 이야기나 한번 듣지""",9.97,2018.09.04 23:00,TRUE,12세 이용가,TRUE,https://comic.naver.com/webtoon/list?titleId=703845
804318,죽음으로 구원하사,고요빛 / 유니,"스토리, 스릴러","연쇄살인마에게 친구들을 잃고 혼자 살아남은 '이설희'는 불길한 아이로 찍혀 괴롭힘을 당한다.강도 높은 괴롭힘으로, 누군가의 죽음이라는 공포가 설희에게는 구원으로 다가오기 시작하는데..그 순간 ""너를 위해서 죽여줄게.""라며 다가오는 한 소년과 만난다.",9.8,2022.12.29 22:00,FALSE,18세 이용가,FALSE,https://comic.naver.com/webtoon/list?titleId=804318
772764,죽지 않으려면,파래 / 임진국,"스토리, 액션",고등학생 임다준은 학교에서 늘상 괴롭힘을 당하는 게 일상이었다. 삶을 포기하기 직전 우연히 본 티비 속 동급생 살해범의 인터뷰에 감명을 받고 복수를 결심하게 된다.복수는 성공했지만 삶은 원치않는 방향으로 흘러가게 되고.. 학교에서 나온 임다준은 범상치않은 가출팸에 들어가게 된다.가출청소년 임다준은 더이상 학교 안 일진들에게 시달리지 않게 되었지만 그보다 잔혹한 길거리의 양아치들을 상대로 살아남아야만 한다.삶의 끝자락에 내몰린 고등학생 임다준의 길거리 생존기!,9.89,2022.09.15 22:58,TRUE,15세 이용가,FALSE,https://comic.naver.com/webtoon/list?titleId=772764
771992,줄라이 블루,신건우,"스토리, 로맨스",아이돌과 합주 팀원이 되야 한다고?!한국예술대학교 실용음악과에 재학중인 여주 한주리.​주리는 합주 시간에 팀원을 구하지 못하게 되고 기숙사에서 쫒겨날 판에 쳐하게 된다.​기숙사에서 쫒겨나지 않으려면 팀을 구해야 하는데...​남은 사람은 아이돌스타 블루?,7.03,2021.05.31 10:00,TRUE,,TRUE,https://comic.naver.com/webtoon/list?titleId=771992
787314,줄리엣의 나라,EGAUN / carbo(도효원),"스토리, 로맨스","여러분은 트레비 분수의 운명을 믿나요?군대를 제대하고 여동생을 찾기 위해 나선 베니스에서 만난 수연에게 첫눈에 반한 류환.""내가 네 나라가 되어줄게.""사랑에 빠진 류환은 운명처럼 만난 수연을 놓치고 싶지 않았다.하지만 그녀의 생각은 달랐던 걸까. 함께 로마 여행을 하던 중 수연은 아무 말 없이 일본으로 돌아가 버린다.재일 조선인이라는 신분으로 어디에도 속할 수 없던, 조총련 의장의 외동딸 민수연 그리고 한 나라 대통령의 아들인 송류환.두 사람이 ‘그럼에도 불구하고’ 사랑을 찾아가는 이야기.",9.37,2022.12.27 22:00,FALSE,전체연령가,TRUE,https://comic.naver.com/webtoon/list?titleId=787314
740132,중독연구소,김택기,"옴니버스, 드라마","중독 가정에서 자라온 소년, ‘김태림’은 중독 전문병원에 입사를 하게 되면서 자신의 문제를 바라보게 된다.우리 모두의 중독 이야기, 당신은 무엇에 중독이 되어있나요?",9.85,2022.12.25 22:00,FALSE,전체연령가,FALSE,https://comic.naver.com/webtoon/list?titleId=740132
643302,중립디자인구역,최남새,"스토리, 판타지",천사와 악마의 의상을 디자인하는 중립디자인구역그곳에 입사한 사회초년생 호양이의 다사다난한 일상,9.67,2016.07.23 23:19,TRUE,12세 이용가,FALSE,https://comic.naver.com/webtoon/list?titleId=643302
771065,중매쟁이 아가 황녀님,박카린 / 지미신,"스토리, 로맨스","피폐 소설 속 아가 황녀로 환생하게 된 주인공은,자신을 키우면서 고생하는 이모를 위해 폭군 남주인 삼촌이 있는 궁으로 들어설 결심을 한다.그런데 실제로 만난 삼촌은, 그저 애정결핍이 쪼~끔 있어보일 뿐인데..?이모도 사랑하고 삼촌도 사랑하는, 아가 황녀님의 러블리 중매 소동",9.94,2022.12.30 22:52,FALSE,전체연령가,FALSE,https://comic.naver.com/webtoon/list?titleId=771065
738174,중증외상센터 : 골든 아워,홍비치라 / 한산이가,"스토리, 드라마","살 수 있는 환자들이 죽어 가고 있다. 이제 더는 그런 일이 없도록 하겠다.사명감 있는 또라이. 중증외상센터의 난폭한 천사. 외상외과 전문의 백강혁, 그의 중증외상센터 되살리기 프로젝트.",9.97,2022.12.26 22:59,FALSE,15세 이용가,FALSE,https://comic.naver.com/webtoon/list?titleId=738174
801999,즐거우리 우리네 인생,현이씨,"옴니버스, 일상",즐거우리 우리네 인생,9.84,2022.11.01 10:00,TRUE,,TRUE,https://comic.naver.com/webtoon/list?titleId=801999
186813,증거,이승찬,"스토리, 스릴러",가장 편안해야 할 공간인 자신의 집이더 이상 자신만의 것이 아니게 되었다!,9.81,2010.12.09 00:06,TRUE,18세 이용가,FALSE,https://comic.naver.com/webtoon/list?titleId=186813
738488,지구멸망버튼,박장고 / 신동구,"스토리, 액션",갑자기 생겨난 의문의 빨간 버튼그리고 필사적으로 버튼을 지켜내려는 자들빨간 버튼을 누르면 지구가 멸망한다고!?,9.74,2021.02.07 23:17,TRUE,12세 이용가,TRUE,https://comic.naver.com/webtoon/list?titleId=738488
