id,title,author,genre,description,rating,date,completed,age,free,link
783591,마스코마스코,남정훈,"스토리, 드라마","신비로운 마법으로 가득한 도시, ‘아크로시티’.그곳엔 마법을 부리고 마법 약을 제조하는 ‘마스코’들이 존재한다.마스코를 동경해온 소녀 ‘돌시’는 우연히 부작용 괴물 때문에 아수라장이 된 현장을 목격하고해독 약을 제조해 단숨에 상황을 종결 시키지만 도리어 인간에게 마법 약을 남용한 용의자로 의심받는 처지에 놓인다.한 편, 괴물 소동에 이어 원로회의 소속인 더블 A급 마스코가 살해되면서 아크로시티의 평화에 금이 가기 시작하는데......",9.63,2021.11.01 10:00,TRUE,,TRUE,https://comic.naver.com/webtoon/list?titleId=783591
660366,마스크걸,매미 / 희세,"스토리, 스릴러","끝내주게 못생기고끝내주게 몸매좋은 여자, 김모미",9.96,2018.06.09 23:23,TRUE,18세 이용가,TRUE,https://comic.naver.com/webtoon/list?titleId=660366
660333,마야고,후렛샤 / 김홍태,"스토리, 스릴러","미스테리 스릴러 빙의,그리고 치명적인 시즌2 마야고!",9.95,2016.03.22 23:24,TRUE,15세 이용가,TRUE,https://comic.naver.com/webtoon/list?titleId=660333
776668,마왕까지 한 걸음,윤홍,"스토리, 판타지","""이건 그냥… 마을 사람 A랑 다를게 없잖아…, 나보다 강한 존재는 이 세계에 있을 수 없어!""세계관 최강자 자리를 위해 지상최강 마왕을 찾아 뭍으로 나온 바다의 왕 유리아.그런데… 거울을 보니 웬 어린아이가…?다리를 얻음과 동시에 그녀의 모든 힘이 사라져 버렸다...그럼에도 여전히 세계최강 자리를 노리고 있는 그녀의 눈물겨운 여정이 시작된다!!",9.97,2022.12.28 22:52,FALSE,15세 이용가,FALSE,https://comic.naver.com/webtoon/list?titleId=776668
793539,마왕의 고백,탑승,"스토리, 판타지","천 년 전 마왕이 남긴 '저주'는 사람을 마술사로 만든다. 마술사라는 정체를 숨긴 채 성기사가 되기를 꿈꾸는 '라피스'.  어느 날 실수로 마왕 '카라'를 소환하고 마는데! ​마왕은 자신을 도와준다면 저주를 거두어 주겠다 하지만... 잠깐, 이 마왕의 고백이 심상치 않다?! ​별을 쫓아 천 년 전 진실에 다가서는 라피스의 아카데미 성장&드라마 판타지!",9.96,2022.12.24 22:51,FALSE,12세 이용가,FALSE,https://comic.naver.com/webtoon/list?titleId=793539
694807,마왕이 되는 중2야,38,"스토리, 판타지",15살 마왕자 명성준인간계 명성중학교에서 마왕이 되기 위한 험난한 성인식을 시작한다,9.93,2020.02.23 23:20,TRUE,전체연령가,TRUE,https://comic.naver.com/webtoon/list?titleId=694807
721919,마음의 숙제,고아라,"스토리, 감성","13년 전 사라진 나의 첫사랑,흡혈귀가 되어 돌아왔다",9.98,2020.07.17 23:23,TRUE,전체연령가,TRUE,https://comic.naver.com/webtoon/list?titleId=721919
20853,마음의소리,조석,"에피소드, 개그",솔직 담백 최강의 개그 만화 <마음의 소리>날 가져요 엉엉,9.86,2020.07.27 23:24,TRUE,전체연령가,TRUE,https://comic.naver.com/webtoon/list?titleId=20853
679568,마이너스의 손,김뎐,"스토리, 판타지",만지면 모두 부서진다.마이너스의 오른손을 가진 소년 이야기,9.96,2018.10.21 23:35,TRUE,전체연령가,FALSE,https://comic.naver.com/webtoon/list?titleId=679568
703634,마주쳤다,하일권 X 네이버웹툰,"스토리, 드라마","기억해줘, 우리가 마주쳤던 순간들. 세상에 없던 나새끼 로맨스 액션툰, 마주쳤다",9.83,2018.01.10 22:00,TRUE,전체연령가,FALSE,https://comic.naver.com/webtoon/list?titleId=703634
765776,마지막 지수,에리카 / 채나라,"스토리, 로맨스","소설가를 꿈꾸는 주인공 양지수.어느날부터 '지수'라는 이름만 골라사귀기로 소문난 바람둥이 '혜성'이 접근해오기 시작한다.이미 남자친구 '도혁'이 있는 지수는 혜성의 접근이 불쾌할 뿐이지만, 한 가지 수상한 점이 자꾸만 호기심을 자극한다.'얘가 어떻게 내 연애사를 낱낱이 알고 있는거지...?'",9.95,2022.05.08 22:59,TRUE,전체연령가,TRUE,https://comic.naver.com/webtoon/list?titleId=765776
797760,마침내 사랑이에요 마왕님!,밀크마스터,"에피소드, 개그","마계를 통일하고 잠시 마왕성을 떠나 권태로운 일상을 보내던 마왕 엘리고르(600살)는 산책 중에 외모에 혹해 한 소년을 구한다.연약하고 부드러운 얼굴, 해사한 표정의 미소년, 제레미엘!!그는 성기사요, 나는 마왕!한낱 인간에 흔들리는 이 감정은, “역시 분노인가?”",9.97,2022.12.26 22:52,FALSE,전체연령가,FALSE,https://comic.naver.com/webtoon/list?titleId=797760
708427,만 화 고,김8,"에피소드, 개그",다양한 그림체의 캐릭터들이 다니는 만화고.존재감 제로인 내가 만화주인공이 될 수 있을까?안경뽀짝 안경희와 친구들의 성장기!,7.23,2018.10.16 23:27,TRUE,전체연령가,TRUE,https://comic.naver.com/webtoon/list?titleId=708427
783117,만능잡캐,"키보드만세, 홍실 / 김대훈","스토리, 판타지","좀비들로 뒤덮여버린 세상. 그런데 이 아포칼립스... 해볼만 하겠는데?![전문가에게서 스킬을 '전수'받을 수 있습니다.] 멘탈케어, 목조건축, 천마신공, 동물교감, 기계공학, 연주 등등.. 배울 게 너무 많아서 문제다! 뭐든 다 잘하는, 준비된 생존자의 질주가 시작된다!",9.87,2022.12.28 22:51,FALSE,15세 이용가,FALSE,https://comic.naver.com/webtoon/list?titleId=783117
759940,만렙돌파,"성불예정,홍실 / 미노","스토리, 판타지","알 수 없는 오류로 3000년간 각성 테스트에 갇힌 김기봉.그 사이 현실에선 10년이 흘렀고, 온 세상은 몬스터와 던전으로 가득차게 되었다. 만렙으로 귀환한 김기봉의 모든 것을 원래대로 돌려놓기 위한 싸움이 시작된다!",9.47,2022.05.29 22:58,TRUE,15세 이용가,FALSE,https://comic.naver.com/webtoon/list?titleId=759940
665174,만렙소녀 오오라,김규삼,"에피소드, 개그","돌아온 븟새와 오오라의 대모험! 
..근데 이거 도대체 무슨 만화지?",9.48,2016.11.08 23:09,TRUE,12세 이용가,FALSE,https://comic.naver.com/webtoon/list?titleId=665174
729964,만물의 영장,보민,"에피소드, 개그","바다에 빠져 실종된 후, 무인도에서 7년 만에 살아 돌아온 우영장의 좌충우돌 문명 적응기!그의 몸은 단단한 근육질로 변했고 온갖 동물과의 의사소통은 물론, 특별한 능력까지 구사하며 사건사고가 끊이질 않는다.과연 영장은 밀림보다 무섭다는 도시에서 살아남을 수 있을까?",9.96,2022.10.26 22:58,TRUE,전체연령가,FALSE,https://comic.naver.com/webtoon/list?titleId=729964
733274,만찢남녀,님니,"스토리, 로맨스","10년도 더 된 순정만화의 주인공이 자신과 이름도, 얼굴도 똑같다는 이야기를 듣게된 한선녀.우연히 그 만화책을 얻게 된 선녀는 호기심에 만화책을 읽다가 잠이 들고, 눈을 떠보니 옆에 누워 있는 사람은 만화 속 남자 주인공 천남욱. 남욱이 만화를 찢고 나온 그 순간부터, 순탄하게 흘러가던 선녀의 학교 생활이 꼬이기 시작한다.",9.97,2020.09.12 23:24,TRUE,전체연령가,TRUE,https://comic.naver.com/webtoon/list?titleId=733274
409100,만화사랑 캠페인,웹툰작가,"에피소드, 일상","윤인완&곽재용, 이준익&형민우, 최현우&하일권, 이말년&이제석, 최훈&최희 등
각계각층을 대표하는 전문가들과 최고의 만화가들의 만남!",6.28,2012.01.22 00:04,TRUE,전체연령가,FALSE,https://comic.naver.com/webtoon/list?titleId=409100
773916,말년용사,후딩 / 신마니,"스토리, 판타지",전역하기 3일 전 어이없는 사고로 죽어버린 말년 병장.갑자기 이세계로 떠나라는 현실을 받아들이지 못하고 난리를 치다맨몸으로 이세계에 떨어지는 벌을 받게 된다.말년 병장의 눈물겨운 밀리터리 생존 판타지!,9.92,2022.12.29 23:00,FALSE,15세 이용가,FALSE,https://comic.naver.com/webtoon/list?titleId=773916
768472,말박왕,용사,"스토리, 액션","이제부터 당신의 허리를 부러뜨릴겁니다.'겉보기엔 평범한 고등학생 한서아, 그가 다니는 하사고등학교는 학생들의 서열을 정한다.게임도, 싸움도 아닌 말뚝박기로!2020 지상최대공모전 1기 우수상 수상작",9.9,2022.08.21 22:55,TRUE,15세 이용가,FALSE,https://comic.naver.com/webtoon/list?titleId=768472
761596,말하는대로,무브,"스토리, 드라마","꿈도 목표도 없이 하루하루를 살아가던 평범한 고등학교 3학년생 주현. 어느 날부터 갑자기 그녀가 말하는 모든 것들이 실제로 이루어지게 된다.특별한 능력을 가지게 되었지만, 그만큼 말하는 것이 편하지만은 않은데... 그녀의 평범하고 반복적이던 일상이 조금씩 뒤틀리기 시작한다!",9.9,2021.07.13 23:12,TRUE,전체연령가,TRUE,https://comic.naver.com/webtoon/list?titleId=761596
729326,맘마미안,미티 / 구구,"스토리, 드라마",아들보다 어려진 엄마?!다 큰 아들의 목숨을 건 엄마 뒷바라지!,9.96,2021.07.10 23:10,TRUE,12세 이용가,TRUE,https://comic.naver.com/webtoon/list?titleId=729326
528784,맛집남녀,츄플엣지,"스토리, 개그",po블로거wer! 맛집 남녀의 스마트한 요절복통 로맨스,7.46,2013.12.10 23:18,TRUE,12세 이용가,FALSE,https://comic.naver.com/webtoon/list?titleId=528784
773796,망나니 소교주로 환생했다,재무 / 전마두 / 대은호,"스토리, 무협/사극","무림의 정쟁에 휘말려 독살당한 고금 제일의 기재, 양자각.분명 죽은 줄로 알았으나 정신을 차리게 되고, 자신이 다른 사람의 몸에 들어와 있다는 것을 알게 된다.알고 보니 자신이 있는 곳은 마교, 익힌 무공은 천마신공,이 몸의 주인은 여색을 탐하고 악귀보다 더한 짓을 하는 망나니 소교주?왜 하필이면 마교에다 이 사람인가!?",9.84,2022.11.25 22:54,FALSE,12세 이용가,FALSE,https://comic.naver.com/webtoon/list?titleId=773796
597466,매지컬 고삼즈,seri / 비완,"스토리, 판타지",수능이 코앞인데 사랑과 평화를 지키라고?고3에 마법소녀가 된 한여름과 그녀를 둘러싼 이야기,9.96,2016.11.30 23:19,TRUE,12세 이용가,TRUE,https://comic.naver.com/webtoon/list?titleId=597466
791062,매지컬 급식:암살법사,웡웡이,"스토리, 판타지","온갖 ‘빌런’들로 가득한 현대사회, 이 어지러운 세상에 정의를 실현하고자 신이 강림했다.그의 정의를 실현 할 용사는 바로… 마법소녀??어쨌든 빌런을 퇴치하고자 마법소녀가 나타났다! 성능 확실한 마법소녀의 빌런 퇴치기!",9.92,2022.12.25 22:58,FALSE,전체연령가,FALSE,https://comic.naver.com/webtoon/list?titleId=791062
753806,매지컬 메디컬,지공,"스토리, 드라마",날 구하러 온 마법 세계 힐러,9.88,2022.02.03 23:00,TRUE,12세 이용가,TRUE,https://comic.naver.com/webtoon/list?titleId=753806
789429,맥시멈퓨리,희나리,"스토리, 드라마","미국 샌프란시스코를 무대로 세계 최대의 Pride 축제일에 펼쳐지는 하드코어 액션 드라마. 무자비한 복수가 불러온 참혹의 대서사시. 거대한 스케일의 초대형 웹툰버스터,잔인한 축제 2부",9.78,2022.02.07 10:00,TRUE,18세 이용가,TRUE,https://comic.naver.com/webtoon/list?titleId=789429
720190,머니게임,배진수,"스토리, 스릴러",게임 일수 100일. 총 상금 448억. 적용 물가 1000배. 당신은 얼마를 벌어 나갈수 있습니까?,9.95,2020.01.10 23:07,TRUE,15세 이용가,TRUE,https://comic.naver.com/webtoon/list?titleId=720190
729038,머리카락을 뽑으면,이다몽,"스토리, 드라마",기억을 잃어버리는 여중생의 잃어버린 기억 찾기,9.92,2020.07.31 23:24,TRUE,전체연령가,TRUE,https://comic.naver.com/webtoon/list?titleId=729038
784255,먹는 인생,홍끼,"옴니버스, 일상",세상에는 먹고싶은 것들이 너무 많아! 나의 맛있는 일기,9.96,2022.12.20 23:00,TRUE,전체연령가,FALSE,https://comic.naver.com/webtoon/list?titleId=784255
724274,먹이,외눈박이 / 박수봉,"옴니버스, 스릴러",‘불길한 것들이 현실로 넘어오기 시작했다’ 귀신을 보는 아이들과 그들이 겪는 악몽 같은 이야기들.,9.98,2021.08.27 23:08,TRUE,15세 이용가,TRUE,https://comic.naver.com/webtoon/list?titleId=724274
735078,먹지마세요,노도 / 비버,"스토리, 판타지",달콤한 복숭아 소년(?)요괴와 귀신들에게 쫓기다.,9.93,2022.06.10 22:59,TRUE,15세 이용가,FALSE,https://comic.naver.com/webtoon/list?titleId=735078
316908,멍순이,김달님,"스토리, 감성","이곳 저곳 산 밖에 안보이는 샛골 마을.그곳에서 일어나는 꽃님이와 멍순이의 흙냄새, 풀냄새 나는 이야기.",9.83,2012.05.07 00:02,TRUE,전체연령가,FALSE,https://comic.naver.com/webtoon/list?titleId=316908
797253,메리의 불타는 행복회로,김지수,"스토리, 드라마","음침한 여고생 유메리는 엄마의 절친이었던 천혜윤과 그의 아들 천사현과 함께 살고 있다.외모, 성적, 사교성, 모든 게 완벽한 그야말로 ‘엄마 친구 아들‘인 사현.사현과 결혼하여 진정한 가족이 되는 것을 꿈꾸는 메리는 과연 사현의 마음을 얻을 수 있을까?",9.93,2022.12.25 22:57,FALSE,전체연령가,FALSE,https://comic.naver.com/webtoon/list?titleId=797253
791140,메모리얼,상C,"스토리, 스릴러","평범한 일상을 보내고 있던 고등학생 '민희'는 예전부터 좋아하던 친구에게 고백을 계획한다.그러나 고백 전날, '그 애'와 관련된 불길한 꿈을 꾸게 되고 현실에서 '그 애'와 관련된 모든 것이 사라지고 만다.모든 것이 혼란스러운 민희는 '그 애'를 찾기 시작하는데..",9.91,2022.12.27 23:00,FALSE,15세 이용가,FALSE,https://comic.naver.com/webtoon/list?titleId=791140
799838,메소드 연기법,김이연,"스토리, 스릴러","메소드 연기로 유명한 천재 배우 서시아.새로운 드라마 방영을 앞둔 그녀의 주변에서 미심쩍은 살인사건이 연이어 일어난다.그녀의 새로운 경호원 봉수는 살인사건과 그녀 사이에 연관성이 있다는 사실을 알아차리고, 비밀을 파헤치기 위해 조금씩 사건을 파고들게 되는데….완벽한 그녀의 연기력, 과연 숨겨진 비밀은 무엇일까?!<뱀이 앉은 자리>, <구독금지> 김이연 작가의 스릴러 신작.",9.95,2022.12.29 22:54,FALSE,15세 이용가,FALSE,https://comic.naver.com/webtoon/list?titleId=799838
733488,메이크 업 드림 - Mak...,김계란 X 네이버웹툰,"에피소드, 드라마",내 안의 또 다른 내가 궁금하세요? 지금 드립니다. 메이크 업 Dream!네이버웹툰과 김계란 작가의특집 5부작 에피소드별 실전 메이크업 가이드를 만나보세요.,7.17,2019.10.06 23:22,TRUE,전체연령가,FALSE,https://comic.naver.com/webtoon/list?titleId=733488
774043,메트로헌터,두엽 / 척준경,"스토리, 판타지",대한민국의 수도인 서울.지하철역 곳곳에서 정체를 알 수 없는 몬스터들이 나타났다.하지만 걱정하지 마라 이 위기에서 당신을 구원해 줄해결사들이 있으니까.우리는 그들을 ‘메트로 헌터’라고 부른다!,9.78,2022.12.30 22:54,FALSE,전체연령가,FALSE,https://comic.naver.com/webtoon/list?titleId=774043
142911,멜로홀릭,팀겟네임,"스토리, 스릴러","교수인형,우월한하루의 팀겟네임.그들의 시니컬 로맨스,'당신은 사랑에 중독되어 보셨습니까?'",9.93,2011.08.16 00:10,TRUE,전체연령가,FALSE,https://comic.naver.com/webtoon/list?titleId=142911
797442,멜빈이 그들에게 남긴 것,삼칠13 / 팀 해피게리 / 류희온,"스토리, 로맨스","""이건 당신을 지키고 복수를 돕기 위한 형식적인 혼인입니다.""네우스 성의 귀한 아가씨, 셰릴.어느 밤, 숙부의 반란으로 오라비가 살해당하고, 그녀 역시 죽임을 당할 위기에 처한다. 모든 걸 포기한 마지막 순간. 구원이 찾아왔다.“기어이 내 혼약자를 죽이고 싶다면. 네우스 성은 전쟁을 각오해야 할 거다.”가짜 혼약을 앞세워 그녀를 구해준 블레어의 성주, 펠릭스. 오라버니의 친구로만 알고 있던 그와의 낯선 결혼생활이 시작된다.",9.97,2022.12.29 22:52,FALSE,12세 이용가,FALSE,https://comic.naver.com/webtoon/list?titleId=797442
789979,멸망 이후의 세계,S-Cynan / 언데드 감자 / 싱숑,"스토리, 판타지",<전지적 독자 시점> 싱숑 작가 원작.이것은 모두가 과거로 돌아갈 때 마지막까지 회귀하지 않았던 한 사나이의 이야기다.,9.92,2022.12.26 22:50,FALSE,15세 이용가,FALSE,https://comic.naver.com/webtoon/list?titleId=789979
771717,멸망X초이스,텐,"스토리, 판타지","수능 날의 간절한 마음이 통한 건지, 정답을 알려주는 능력을 가지게 된 서준.이 능력으로 즐거운 대학생활, 창창한 앞날만 있다고 생각했는데 갑자기 나타난 멸망의 신 앙골모아가 모든 걸 엉망진창으로 만들기 시작한다.지구 멸망만큼은 안돼! 과연 서준은 지구와 자신의 안위를 지켜낼 수 있을 것인가?",9.83,2022.06.08 22:59,TRUE,12세 이용가,TRUE,https://comic.naver.com/webtoon/list?titleId=771717
784843,멸망급 빌런들의 선생님,이지 / 떡구이 / SANA,"스토리, 판타지","“멸망급 빌런이 될 운명인 아이들을 헌터로, 그것도 전설급 헌터로 만든다면 멸망을 막을 수 있지 않을까?”가만히 있으면 기다리는 것은 그저 처참한 멸망뿐인….",5.25,2022.12.24 22:00,FALSE,전체연령가,TRUE,https://comic.naver.com/webtoon/list?titleId=784843
791892,멸종위기종인간,사하라,"스토리, 판타지","거대한 혜성이 지구를 덮친 날,모든 인간들의 소원이 이뤄지고 말았다.오히려 재앙이 되어버린 이 세상에서  소원으로 능력은 얻은 이들은인류의 멸종을 맞선 영웅이 되기로 선택한다.",8.96,2022.12.27 22:59,FALSE,15세 이용가,FALSE,https://comic.naver.com/webtoon/list?titleId=791892
786908,모기전쟁,정지훈,"스토리, 판타지","모기가 지구 최강의 포식자로 거듭난 후 100년, 아직 인류의 희망은 사라지지 않았다!",9.95,2021.12.27 10:00,TRUE,,TRUE,https://comic.naver.com/webtoon/list?titleId=786908
794942,모노마니아,구리,"스토리, 드라마","사랑스러운 외모와 밝은 성격으로 인기가 많은 '지우'. 하루가 멀다 하고 고백을 받지만, 막상 연애를 시작하면 집착하는 습관 때문에 금방 차이고 만다. 아무도 지우를 이해해 주지 않았지만, 어느 날 나타난 편입생 '이재'만이 그녀의 이야기를 들어준다.지우는 이재에게 점차 빠져들고 묘한 소유욕까지 느끼게 되는데...이재의 진짜 관심사는 뭘까?​",9.89,2022.12.25 22:50,FALSE,15세 이용가,FALSE,https://comic.naver.com/webtoon/list?titleId=794942
521504,모던패밀리,외눈박이 / 시현,"스토리, 개그",행복한 가정을 이루기 위해 고군분투하는 어느 수상한 가족 이야기.그들의 기상천외한 리얼 감성 코믹극!,9.94,2014.03.07 23:15,TRUE,전체연령가,FALSE,https://comic.naver.com/webtoon/list?titleId=521504
617882,모던패밀리 2,외눈박이 / 시현,"에피소드, 개그",행복한 가정을 이루기 위해 고군분투하는 어느 수상한 가족 이야기그 두번째 시즌!,9.68,2016.06.17 23:14,TRUE,전체연령가,FALSE,https://comic.naver.com/webtoon/list?titleId=617882
764128,모두 너였다,이순기 / 오정호 / 이재익,"스토리, 로맨스","근 미래, 생체공학박사이자 클론 테스터 '유리'는 남편의 외도로 하루하루를 고통 속에 살고 있다.그러던 어느 날, 한달 후 폐기될 운명의 최신형 연애클론 '빅터'를 테스트하기 시작한다. 그녀는 어느샌가 빅터로부터 마음의 위안을 얻는 한편, 남편이 자신에게 저지른 끔찍한 일들을 깨닫게 되는데...!",9.96,2022.12.30 22:59,FALSE,12세 이용가,FALSE,https://comic.naver.com/webtoon/list?titleId=764128
471283,모두에게 완자가,완자,"에피소드, 일상","아무도 눈치보지 않고 사랑할 수 있는 그날이 오기를!
사랑하며 살아가는 그녀들의 일상이야기 <모두에게, 완자가>",9.71,2015.02.14 23:20,TRUE,12세 이용가,FALSE,https://comic.naver.com/webtoon/list?titleId=471283
802941,"모든 숨마다, 너",클로버9 / 골드또잉 / 김결,"스토리, 로맨스","업계에서 인정받는 패션쇼 연출가 치린.겉모습은 씩씩해 보이지만, 마음 한쪽엔 아물지 않은 상처를 안고 있다.업무에 자신을 내던지며 상처의 아픔을 이겨내는 그녀 앞에 나타난 다국적 패션 기업 이사. 지헌.그런데, 이 남자 밑도 끝도 없이 치린에게 직진한다.치린은 자신의 커리어를 지키기 위해 지헌의 유혹을 온몸으로 뿌리치려 하는데….",9.91,2022.12.24 22:00,FALSE,15세 이용가,TRUE,https://comic.naver.com/webtoon/list?titleId=802941
604146,모디파이,임달영 / 이수현,"스토리, 드라마","최고가 될 수 있는가!  
스피드의 모든 것을 건 R.C 레이서들의  
국내 최초 본격 R.C 웹툰!",8.61,2014.10.11 23:09,TRUE,15세 이용가,FALSE,https://comic.naver.com/webtoon/list?titleId=604146
734918,모락모락 왕세자님,원해,"스토리, 로맨스",온천마을에 찾아온 꽃미남 왕세자일행과신비한 힘을 가진 소녀의 판타지 로맨스,9.89,2022.08.28 22:59,TRUE,전체연령가,FALSE,https://comic.naver.com/webtoon/list?titleId=734918
772243,모스크바의 여명,이샨오 / 황장미,"스토리, 드라마","21세의 피아니스트 이시윤.사고로 인해 피아노를 더 이상 칠 수 없게 된 삶을 비관하다 죽음을 택했지만,알아들을 수 없는 외국어로 얘기하는 갑부 집안에서소녀 '타티아나'로 눈을 뜬다.신이 주신 기회인 걸까? 아니면 저주인 걸까?성별이 바뀐 게 뭐 대수냐! 손만 멀쩡하다면 다시 피아노를 칠 수 있어!어차피 이렇게 된 거 '타티아나'로서 못다 한 꿈을 이뤄보자!",9.95,2022.12.25 22:56,FALSE,전체연령가,FALSE,https://comic.naver.com/webtoon/list?titleId=772243
771985,모어 라이프,이아영,"스토리, 로맨스","모두가 두 개의 목숨을 가진 세계! 태어날 때부터 목숨이 하나였던 영하는 늘 주변의 걱정과 과보호 속에 자랐다.대학생이 된 후 어렵사리 카페 알바에 도전한 영하, 그곳에서 본인보다 더 평범하지 못한 주희를 만나게 되는데...목숨이 두 개인 세계에서 평범하지 못한 두 남녀의 목숨이 걸린 로맨스!",9.94,2022.12.28 22:57,FALSE,전체연령가,FALSE,https://comic.naver.com/webtoon/list?titleId=771985
728015,모죠의 일지,모죠,"에피소드, 개그",소신있는 취향과 내성적인 성향.훌륭한 집순이 모죠의 은밀한 비밀들,9.97,2021.09.24 22:57,TRUE,전체연령가,TRUE,https://comic.naver.com/webtoon/list?titleId=728015
622648,모태솔로수용소,석재윤,"스토리, 드라마",모태솔로가 중범죄자 취급받는 미래의 한국엉겁결에 잡혀들어온 독고남과 수감자들의 우여곡절 코믹 탈주기,9.92,2015.08.16 23:15,TRUE,15세 이용가,TRUE,https://comic.naver.com/webtoon/list?titleId=622648
666670,모태솔로수용소 시즌2~3,석재윤,"스토리, 드라마","연애를 하지 못하면 범죄자가 되는 세상,모태솔로들의 탈옥이 시작된다!",9.93,2018.09.03 23:02,TRUE,15세 이용가,TRUE,https://comic.naver.com/webtoon/list?titleId=666670
792452,모텔 304호,이말랭,"스토리, 스릴러","취직 면접을 위해 서울로 상경한 '우연',  하룻밤을 묵게 된 고급스러운 모텔의 액자 뒤에서 건너편 방이 보이는 매직미러를 발견한다. 게다가 그곳에 있던 건 국민 걸그룹 릴리즈의 멤버 '수진'. 경찰에 신고하려던 찰나, 수진의 방에 정체불명의 남자가 찾아와 그녀에게 서슬퍼런 칼을 들이민다.일촉즉발의 상황 우연은 수진의 방, 304호로 달려간다.",9.64,2022.08.18 22:58,TRUE,15세 이용가,FALSE,https://comic.naver.com/webtoon/list?titleId=792452
727191,모퉁이 뜨개방,소영,"스토리, 감성",회색빛 일상에 지쳐있던 현이어느 날 만나게 된 모퉁이 뜨개방에서 자신의 상처를 마주하며 치유해간다,9.98,2020.03.18 23:19,TRUE,전체연령가,TRUE,https://comic.naver.com/webtoon/list?titleId=727191
697681,목욕의 신,하일권,"스토리, 드라마",신의 손을 가진 남자최고의 목욕관리사가 되기위한 때밀이 배틀이 시작된다.,9.97,2018.01.16 23:01,TRUE,전체연령가,TRUE,https://comic.naver.com/webtoon/list?titleId=697681
