id,title,author,genre,description,rating,date,completed,age,free,link
772005,아내를 죽였다,희나리,"스토리, 스릴러","친구와 술을 마신 후 곯아떨어진 ‘정호’는 숙취로 눈을 뜬 다음 날 아침, 별거 중이던 아내 ‘미영’이 살해당했다는 충격적인 소식을 듣게 된다. 그 순간, 자신의 옷에 묻은 핏자국과 피 묻은 칼을 발견한 ‘정호’. 가장 강력한 용의자로 지목된 그는 경찰의 눈을 피해 도망친다.알리바이를 입증하고 싶지만 전날의 술로 인해 필름이 끊겨 있는 정호는, 부분부분 떠오르는 기억의 조각들을 붙잡고, 또 어젯밤같이 술을 마신 친구를 비롯한 다른 주변 인물들의 진술을 토대로 자신의 어제 행방을 추적하면서 무죄를 입증하려 한다. 그런데 자신의 기억과 주변의 이야기들을 조각조각 맞추다 보니 정말 내가 아내를 죽였을지도 모른다 라는 생각에 이르게 된다.  <아내를 죽였다>는 숙취 가득한 정호가 누명을 벗기 위해 또한 아내의 죽음을 둘러싼 진실을 파헤치기 위해 죽을 힘을 다하는 하루 동안의 현재 이야기와 정호와 아내 미영이 별거까지 갈 수 밖에 없었던 그의 어두운 과거 이야기가 두 개의 축으로 엮이면서 이 사건의 진실에 접근해가는 구성으로 끝까지 긴장감을 유지하며 충격적인 결말까지 이어진다. 2019년 이시언 주연의 영화로 개봉, 호평을 받았다.",9.56,2021.06.21 10:00,TRUE,,TRUE,https://comic.naver.com/webtoon/list?titleId=772005
738809,아는 여자애,허니비,"스토리, 로맨스","어느날 갑자기 고등학생으로 돌아온 하영. 다시 한 번 기회가 주어진다면 첫사랑을 이룰 수 있을까?내게는 운명, 그애에겐 아는 여자애",9.97,2022.04.17 22:59,TRUE,전체연령가,TRUE,https://comic.naver.com/webtoon/list?titleId=738809
460686,아는사람 이야기,오묘,"스토리, 로맨스","25세 세 여자 미라 여름 정아의 소소하고 평범한, 울고 웃고 사랑하는 이야기.나와 당신과 그리고, <아는사람 이야기>",9.95,2013.06.13 23:14,TRUE,전체연령가,TRUE,https://comic.naver.com/webtoon/list?titleId=460686
725829,아도나이,주동근,"스토리, 스릴러","경신일보 유미건 기자는 어느 날 의문의 제보 메일을 받게 된다. 그녀는 알 수 없는 이끌림에 매료되어 외계인을 믿는 사이비종교 '앙천회'에 잠입 취재를 감행한다. 그런데 이 종교, 알면 알수록 위험하다. <지금 우리 학교는> 주동근 작가의 미스테리 스릴러.",9.9,2022.12.27 22:59,FALSE,15세 이용가,FALSE,https://comic.naver.com/webtoon/list?titleId=725829
563782,아랫집 시누이,김진,"에피소드, 일상","대를 물려 내려오는 고부갈등? 노노!시월드, 이제는 무섭지 않아요!",9.95,2013.12.22 23:06,TRUE,전체연령가,TRUE,https://comic.naver.com/webtoon/list?titleId=563782
710768,아르마,병장,"스토리, 판타지","인간을 해칠 수 없는 초능력자, 인류의 구원이 되다!",9.96,2020.03.04 23:19,TRUE,15세 이용가,TRUE,https://comic.naver.com/webtoon/list?titleId=710768
741458,아르세니아의 마법사,SAYM / 박성호,"스토리, 판타지",평범한 고등학생에서 벗어나 레드 드래곤 레이어드에 의해 아르세니아 대륙으로 소환된 이결.집으로 가기 위해서는 마법사가 되어서 드래곤 하트 조각을 모아야만 한다!마법사가 되어버린 고등학생 이결은 새로운 동료들과 함께 아르세니아 대륙 모험을 시작한다!,9.88,2021.10.23 22:51,TRUE,12세 이용가,FALSE,https://comic.naver.com/webtoon/list?titleId=741458
801014,아마데우스(Amadeus),12 / 6,"스토리, 드라마","큰 고민 없고 밝은 성격의 평범한 학생, 시아.어느 날 갑자기 살인 연극에 참여하게 된다. 살아남기 위해 벌어지는 여러 가지 상황에 회의감을 느끼지만... 최후의 1인이 되면 소원을 이룰 수 있다. 하지만 시아가 원하는 건 단 하나! 그저 동료와 함께 살아남기 위해 노력할 뿐이다.",9.51,2022.10.10 10:00,TRUE,,TRUE,https://comic.naver.com/webtoon/list?titleId=801014
791058,아마도,마파체,"스토리, 스릴러","""내가 하는 말 절대로 믿지마. 믿기지도 않겠지만..""해안가 시골 마을로 좌천된 강력계 형사 '무강'은 미스터리한 시체의 진실을 밝히기 위해 '아마도'로 향한다. 그 곳에서 마주하게 된 미지의 종교와 함께, 사건의 실마리는 점점 더 꼬여만 가는데...",9.48,2022.12.25 22:55,FALSE,15세 이용가,FALSE,https://comic.naver.com/webtoon/list?titleId=791058
795041,"아마도, 굿모닝",은나 / 솜베 / 우지혜,"스토리, 로맨스","""시중은 내가 들죠. 당신이 기뻐할 때까지 최선을 다할 겁니다.""사업 확장을 위한 투자 회사를 찾을 생각이었건만,나, 진이영에게 날아온 제안서에는 '계약 결혼'에 대한 내용이 적혀있었다.상대는 망나니로 소문난 구교헌. 하지만 그렇게 나쁜 거래는 아니다.그렇게 쇼윈도 부부로만 살아갈 줄 알았는데, 이 남자. 나에게 자꾸만 접근해온다.우리, 계약 결혼 아니었어요?",9.87,2022.12.24 22:50,FALSE,전체연령가,FALSE,https://comic.naver.com/webtoon/list?titleId=795041
622644,아메리카노 엑소더스,박지은,"스토리, 판타지",서울 한복판에 깜찍한 마법사 등장?!당신을 위한 이색 판타지!,9.42,2019.02.08 23:22,TRUE,전체연령가,TRUE,https://comic.naver.com/webtoon/list?titleId=622644
113119,아부쟁이,이익수,"스토리, 드라마","사고뭉치 불량 복학생들만 다닌다는 풍랑고. 
육식동물들이  즐비한 곳에 홀로 먹잇감으로 던져진 주인공 박건의 살아남기 위한 몸부림...",9.91,2012.10.15 23:16,TRUE,12세 이용가,FALSE,https://comic.naver.com/webtoon/list?titleId=113119
774451,아빠같은 남자,이수민,"스토리, 드라마","“마음에 드실거예요. 아빠같은 남자거든요.”사이코패스 성격을 숨기고 살아가는 로펌대표 묘인준은 자신의 본성을 잘 감춘 채 재력과 권력, 그리고 겉보기에 화목한 가정까지 모든 걸 갖추고 살아가고 있다. 어느 날 끔찍히 사랑하는 외동딸 수진이 아버지 묘인준에게 결혼할 남자(정이현)를 소개하게 되는데, 묘인준은 그 순간 딸의 남자가 자신과 같은 부류의 인간임을 알아본다. 자신이 이룬 모든 것의 상징과도 같은  딸을 향해 접근하는 것은 물론, 여러 의심스러운 상황에서 계속 마주치게 되는 정이현...묘인준은 그에게 딸을 뺏길 수 없다는 생각을 하게 되지만, 자신의 두 얼굴을 들키지 않으면서 딸을 지키기란  쉽지 않다. 거기에 더해 자신과 자신의 회사 법무법인 노블의 주변에서는 끊임없이 잡음이 들려오기 시작하고, 묘인준의 내재된 본성이 서서히 모습을 드러내며  상황은 점점 복잡해진다.",9.8,2022.12.28 22:55,FALSE,12세 이용가,FALSE,https://comic.naver.com/webtoon/list?titleId=774451
509093,아빠를 찾습니다,동비,"스토리, 드라마","돈이 없는 현수, 부모가 필요한 하연.두 사람의 서먹서먹한 가족생활이 시작된다!",9.86,2013.10.04 23:10,TRUE,18세 이용가,FALSE,https://comic.naver.com/webtoon/list?titleId=509093
786496,아사,우새새,"스토리, 판타지","인간들에게 사로잡힌 마물의 왕「아사」.감옥탑에 유폐된 아사는, 태자 정진과 장군 무량 사이에 분열을 일으켜 그들의 자멸을 꾀한다. 황궁을 배경으로 펼쳐지는 정치암투와 액션, 예측불가 동양판타지.",9.95,2022.11.25 23:00,FALSE,15세 이용가,FALSE,https://comic.naver.com/webtoon/list?titleId=786496
798277,아슈타르테,SOON / 안다온,"스토리, 로맨스","무한한 영광을 가져다줄 피렌체 제국의 빛,아슈타르테. 하지만 음모로 인해 예언은 뒤틀리고...아슈타르테가 어둠으로 알려지게 되면서 모두가 그녀를 외면한다. 가족들의 사랑을 꿈꾸던 어린아이에서 점점 강인한 소녀로 자라는 '아슈타르테'의 성장기.",9.79,2022.12.25 22:52,FALSE,전체연령가,FALSE,https://comic.naver.com/webtoon/list?titleId=798277
112931,아스란영웅전,박성용,"옴니버스, 판타지","포악한 드래곤이 사라지고 대륙은 평화를 되찾았다. 하지만 용사의 평화는 아직 멀기만 한데...
평화로운 세상에서 펼쳐지는 용사의 두번째 이야기.본격 판타지 추리만화.",9.94,2012.08.23 23:02,TRUE,15세 이용가,FALSE,https://comic.naver.com/webtoon/list?titleId=112931
739114,아이고 아이고,하모,"스토리, 드라마",자유분방한 삶을 살던 가수 지망생.불의의 사고를 겪고 장례지도사가 되기를 결심한다.,9.93,2021.01.11 23:26,TRUE,전체연령가,TRUE,https://comic.naver.com/webtoon/list?titleId=739114
318994,아이고(IGO),김우준,"스토리, 드라마","홍대 주변에서 '벽화'를 그리며 지내는 벽화 팀 ‘IGO’모두들 자유로이 벽화를 그리는 듯 보이지만 그곳에도 그들만의 법칙이 있다.다른 팀들과의 벽화 배틀을 통해 승리한 팀이 영역(벽)을 차지하는 시스템 속에서 서로의 영역을 넓히기 위해 배틀을 벌이는 그들, 그리고 우리들의 이야기.시퍼렇게 살아 숨 쉬는 청춘의 한 자락이 그림 속에 펼쳐진다.",9.92,2012.05.04 00:04,TRUE,전체연령가,TRUE,https://comic.naver.com/webtoon/list?titleId=318994
642599,아이덴티티,시니 / 수훈,"스토리, 드라마","잠에 들면 다른 사람이 되는 남자 헨리 모리스, 그리고 그 병을 치료하는 Dr.와이번.[죽음에 관하여] 스토리 시니 작가의 신작.",9.97,2016.01.13 23:10,TRUE,12세 이용가,FALSE,https://comic.naver.com/webtoon/list?titleId=642599
663887,아이돌 연구소,해마 / 연제원,"에피소드, 개그",아이돌의 모든 것!지금부터 아이돌 연구소가 알려준다,9.45,2016.07.02 23:09,TRUE,전체연령가,FALSE,https://comic.naver.com/webtoon/list?titleId=663887
801516,아이돌만 하고 싶었는데,고구렁 / 와플,"스토리, 로맨스","생방송 무대에서 쌍코피가 거하게 터진 뒤로 폭발적인 인기를 얻게 된 <유로파>의 멤버 빛나. 앞으로 승승장구할 생각에 들떠있던 것도 잠시, 그날 이후로 자신의 몸이 달라졌음을 알게 된다. <어웨이큰>의 멤버 찬선과 함께 주변에서 일어나는 수상한 일들을 파헤치게 되고 자신들이 위험한 일에 휘말렸다는 것도 알게 된다. 하지만 이제 와서 도망칠 수도 없는 상황. 피 튀기고 혼란스러운 일상 속에서 그들은 과연 끝까지 아이돌이란 신분을 지킬 수 있을까..?",9.94,2022.12.30 22:52,FALSE,15세 이용가,FALSE,https://comic.naver.com/webtoon/list?titleId=801516
792120,아이돌의 비밀 스터디,우아람,"스토리, 드라마",책임감과 성실함의 아이콘인 서우는 다니고 있는 대학의 축제 초청 가수인 아정에게 상해를 입힌다. 예기치 못한 사고. 수습을 막막해 하던 서우는 아정에게 은밀하고 아슬아슬한 제안을 받게 되는데...세상에서 가장 특별하고 특이한 학생을 지도하게 된 서우. 서우는 이 학생을 감당해낼 수 있을까?,9.6,2022.10.11 22:55,TRUE,12세 이용가,FALSE,https://comic.naver.com/webtoon/list?titleId=792120
570502,아이들은 즐겁다,허5파6,"스토리, 드라마",흐릿하지만 섬세했던 유년기담담한 아이들의 이야기.,9.96,2014.05.26 23:11,TRUE,12세 이용가,TRUE,https://comic.naver.com/webtoon/list?titleId=570502
460687,아이들의 권 선생님,호우,"옴니버스, 드라마",아이들의 히어로! 조폭 선생님과 다섯 꼬마들의 소소한 학교 일상 이야기.,9.95,2013.11.30 23:10,TRUE,전체연령가,TRUE,https://comic.naver.com/webtoon/list?titleId=460687
754875,아이레,설이 / Team 설이,"스토리, 판타지",사라진 여왕의 힘을 찾기 위한 여정.그들의 위대한 모험이 시작된다.,9.83,2021.12.06 22:50,TRUE,12세 이용가,FALSE,https://comic.naver.com/webtoon/list?titleId=754875
793381,아이리스,차우민,"스토리, 판타지",한때 폭발적인 인기를 누리던 게임 '아이리스'망해 가는 게임의 부활을 위해 만렙 유저와 운영자가 뭉쳤다!,9.7,2022.04.18 10:00,TRUE,,TRUE,https://comic.naver.com/webtoon/list?titleId=793381
570505,"아이소포스 1, 2부",김양수 / 도가도,"스토리, 무협/사극","이솝우화의 이솝, 자신의 운명을 바꾼 한 사람의 이야기.",9.96,2015.10.27 23:04,TRUE,12세 이용가,FALSE,https://comic.naver.com/webtoon/list?titleId=570505
675474,아이소포스 3부,김양수 / 도가도,"스토리, 무협/사극","이솝우화의 이솝, 자신의 운명을 바꾼 한 사람의 이야기.아이소포스가 3부로 돌아왔다",9.95,2016.08.23 23:17,TRUE,12세 이용가,FALSE,https://comic.naver.com/webtoon/list?titleId=675474
767908,아이즈,정썸머,"스토리, 액션","한 쪽 눈이 없는 고등학생 '서주안'은 매일 학교에서 섬뜩한 시선을 느낀다.두려움에 떨면서도 시선의 정체를 궁금해하던 중, '조류인간'의 존재를 알게되어 혼란에 빠지고...서늘한 긴장감이 감도는 가운데, 조류인간들의 전쟁이 시작된다!",9.95,2022.12.26 22:56,FALSE,15세 이용가,FALSE,https://comic.naver.com/webtoon/list?titleId=767908
737835,아이키우는만화,쇼쇼,"에피소드, 일상",아기를 낳는다고 끝은 더더욱 아니지출산 후 펼쳐지는 어나더 레벨의 세상!,9.46,2020.04.29 23:09,TRUE,전체연령가,TRUE,https://comic.naver.com/webtoon/list?titleId=737835
792280,아인슈페너,한끼룩,"스토리, 스릴러","항상 남의 눈치를 살피느라 자신은 뒷전인 민다래. 어느 날 동기들에게 자신의 뒷담화를 듣고 관계의 현타가 오는데, 이 모든 게 자신의 유일한 안식처인 남자친구와 관련이 있다?",9.96,2022.12.28 22:53,FALSE,15세 이용가,FALSE,https://comic.naver.com/webtoon/list?titleId=792280
769747,아찔한 전남편,마풍각 / 여백 / 별규,"스토리, 로맨스","국민 여배우 하은설.여배우 전성기 시절 남편과 첫눈에 반해서 결혼했고, 1년 만에 헤어졌다.대한민국 톱배우였던 하은설의 입지는 바닥까지 추락했다.하지만 하은설, 악착같이 일어나 재기에 성공했다!그리고 4년 뒤, …그가 다시 나타났다.전남편의 유혹에 넘어가지 않기 위한 은설의 힘겨운 사투!과연 성공할 수 있을까?",9.88,2022.12.29 22:50,FALSE,15세 이용가,FALSE,https://comic.naver.com/webtoon/list?titleId=769747
753304,아침을 지나 밤으로,손지은,"스토리, 판타지",사과나무의 대가로 48일간 아이를 빌려가겠습니다'기묘한 편지와 함께 사라진 동생 녹스를 찾아 헤매는 마네의 모험을 그린 정통 판타지2019년 네이버웹툰 최강자전 2위 수상작!,9.96,2022.12.30 22:50,FALSE,전체연령가,FALSE,https://comic.naver.com/webtoon/list?titleId=753304
795529,아카데미에 위장취업당했다,타나 / WAG / sayren,"스토리, 판타지",제국에서 제일가는 마법 아카데미의 교사가 되었다.…다른 사람과 착각당해서.그 어느 쪽에도 정체를 들켜선 안 되는 상황.이 아슬아슬한 외줄 타기의 끝은 어디일까.,9.96,2022.12.24 22:51,FALSE,12세 이용가,FALSE,https://comic.naver.com/webtoon/list?titleId=795529
679543,아테나 컴플렉스,케이사르,"스토리, 판타지",이런 여신님은 처음!어느 여신님의 수천년에 걸친 애절한 짝사랑 이야기,9.88,2021.04.16 23:10,TRUE,12세 이용가,FALSE,https://comic.naver.com/webtoon/list?titleId=679543
804055,아포크리파,은성 / 두만식,"스토리, 스릴러","구마의식에 평생을 바친 베르나르도와 도미니코는 인정받는 엑소시스트이다.두 사람의 은퇴가 결정되자 바티칸 상층부는 그들을 한국에서 노년을 보내도록 조치한다.낯선 이국 땅에서의 생활에 대한 긴장과 설렘도 잠시,무언가 잘못되어 가는 것을 두 사람은 눈치챈다.",9.89,2022.12.24 22:00,FALSE,15세 이용가,FALSE,https://comic.naver.com/webtoon/list?titleId=804055
608258,아프니까 병원이다,고리타,"에피소드, 일상","환자의 입장에서 그리는 병원에서의 일상
가끔은 슬프고, 또 가끔은 가슴뭉클한 진짜 병원 생활기",9.89,2014.11.28 23:22,TRUE,전체연령가,FALSE,https://comic.naver.com/webtoon/list?titleId=608258
724815,아홉수 우리들,수박양,"스토리, 로맨스","연애, 직장, 시험 어느 하나 뜻대로 되지 않는 29살 봉우리, 차우리, 김우리. 제대로 걸렸다! 아.홉.수!우리들의 팩트폭행 로맨틱 코미디!",9.97,2022.12.30 22:53,FALSE,전체연령가,FALSE,https://comic.naver.com/webtoon/list?titleId=724815
783525,악녀 18세 공략기,홍혜,"스토리, 로맨스","로판 웹툰 속 악녀 라이사가 웹툰 원 작가인 18살 유도은의 몸으로 빙의돼버렸다!이 세계에 빙의된 것도 억울한데, 내가 죽을 운명의 악녀라고?!자신의 결말을 바꾸기 위한 작가 공략기!",9.96,2022.12.25 23:00,FALSE,전체연령가,FALSE,https://comic.naver.com/webtoon/list?titleId=783525
443421,악당의 사연,랑또,"스토리, 개그","홍어단이 대한민국을 정복했다? 그럼 러브레인저는 어쩌라고!!랑또 작가의 '악당의 사연' 시즌2, 4월2일 컴백!",9.92,2012.09.23 23:08,TRUE,12세 이용가,FALSE,https://comic.naver.com/webtoon/list?titleId=443421
784849,악당이 살아가는 법,감사크 / 이마식 / 룬드그린,"스토리, 액션","당신은 차기 신의 후계자를 뽑는 위대한 게임, 더 미션의 플레이어로 선택받으셨습니다! 축하드립니다! 갑작스레 이세계에 떨어져 신이 되는 서바이벌 게임에 참여하게 된 성훈.판타지 게임과 흡사한 이세계, 서로 협력하기도, 죽이기도 하는 피도 눈물도 없는 플레이어들…!!재능이라곤 하나 없는 성훈은 비열함과 조잡한 술수로 점차 만능캐가 되어간다!",9.89,2022.12.30 22:00,FALSE,전체연령가,TRUE,https://comic.naver.com/webtoon/list?titleId=784849
753223,악령주의보,토마토모닝,"스토리, 액션","귀신을 보는 소녀 순심. 어느 날, 외면하고 싶었던 사건에 뛰어들다...?!나에게는... 귀신이 보인다...!",9.83,2021.02.26 23:58,TRUE,전체연령가,FALSE,https://comic.naver.com/webtoon/list?titleId=753223
793853,악마라고 불러다오,자양 / 써나 / 안테,"스토리, 로맨스","낮에는 성형외과 의사로, 밤에는 악마로 살아가는 '현신'.  눈빛만으로 누구든 유혹하는 마력을 가졌지만,어느 날 나타난 '이나'에게는 유혹이 통하지 않는다.대신 태평한 얼굴로 가슴 수술을 해달라 하는데... 이 여자는 뭘까?",9.95,2022.12.29 22:50,FALSE,15세 이용가,FALSE,https://comic.naver.com/webtoon/list?titleId=793853
746745,악마에게 은총을,백지연 / 스튜,"스토리, 드라마","악마를 향한 순정, 결말은?",9.77,2020.05.28 17:00,TRUE,전체연령가,TRUE,https://comic.naver.com/webtoon/list?titleId=746745
710750,악마와 계약연애,장진 / 움비,"스토리, 로맨스",아무것도 원하지 않는 인간 한나.갑자기 나타난 악마와 영혼을 걸고 계약을 하게 되다?!,9.98,2020.11.16 23:25,TRUE,12세 이용가,TRUE,https://comic.naver.com/webtoon/list?titleId=710750
793283,악몽의 형상,김용키,"스토리, 스릴러","타인은지옥이다', '관계의종말' 이후 9년..종우와 다은은 여전히 끔찍한 지옥 속에서 살고 있다.그러던 어느 날, 과거 고시원 사건과 펜션 사건을 방불케하는 살인 사건이 벌어지고당시 두 사건을 수사했던 정형사는 종우와 다은을 찾는다.그리고 끔찍했던 악몽은 점점 다가오는 형상이 된다.",9.92,2022.12.30 22:58,FALSE,15세 이용가,FALSE,https://comic.naver.com/webtoon/list?titleId=793283
766626,악몽일기,육공,"옴니버스, 스릴러","섬뜩한 악몽을 기록해둔 옴니버스식 공포 스릴러!과연 이것은 악몽일까, 현실일까?평범했던 주인공들의 삶이 기이한 악몽으로 변해간다.",9.84,2022.07.28 22:59,TRUE,15세 이용가,TRUE,https://comic.naver.com/webtoon/list?titleId=766626
94760,악연,황준호,"스토리, 스릴러",싸이코패스.연쇄살인범.그리고 마주치는 사람들.,9.9,2010.03.16 00:06,TRUE,18세 이용가,FALSE,https://comic.naver.com/webtoon/list?titleId=94760
657522,악의는 없다,환쟁이,"스토리, 스릴러","시골 마을, 한 남자가 죽었다.그 죽음의 진실을 파헤치려는 이와 덮으려는 자의 싸움.",9.48,2016.12.31 09:25,TRUE,15세 이용가,FALSE,https://comic.naver.com/webtoon/list?titleId=657522
759924,악인,광탄토 / 마두르,"스토리, 스릴러","타인의 생각을 눈으로 볼 수 있는 주인공 봉강.자신의 능력을 이용해서 소소한 일상을 보내던 중, 과내 최고 인기남 조훈 선배의 속마음을 보게 된다. 하지만 그가 마주한 진실은... 온갖 '살의'로 가득찬 살인자 훈의 또 다른 모습이었다.",9.75,2021.12.06 22:55,TRUE,15세 이용가,TRUE,https://comic.naver.com/webtoon/list?titleId=759924
729946,악취,디귿,"스토리, 스릴러","며칠 전부터 아랫집에서 썩은 내가 나기 시작했다. 냄새가 나고 얼마 뒤, 친구가 사라졌다. 그리고 아랫집 누나까지. 그 다음은...? 사라진 사람들, 그리고 그들을 찾는 사람들의 이야기!",9.92,2020.05.31 23:24,TRUE,15세 이용가,FALSE,https://comic.naver.com/webtoon/list?titleId=729946
551651,악플게임,미티,"스토리, 드라마","우승상금 10억! 대한민국 최고의 악플러를 뽑는 대회가 펼쳐진다. <남기한 엘리트만들기>, <고삼이 집나갔다> 미티 작가 신작!",9.84,2014.02.15 23:06,TRUE,12세 이용가,TRUE,https://comic.naver.com/webtoon/list?titleId=551651
602923,안 돼요 마왕님!,마로,"스토리, 로맨스","인터넷 소설 마니아 마왕, 진정한 사랑을 찾아 인간계로 떠나다. 
본격 순정 코미디.",9.96,2015.09.24 23:13,TRUE,전체연령가,FALSE,https://comic.naver.com/webtoon/list?titleId=602923
731930,안개무덤,김태영,"스토리, 스릴러","실종된 가족을 수사하려고 하면 할수록, 알 수 없는 초자연 현상에 시달린다.사건 현장을 뒤덮는 벌레들. 그리고 부적. 이곳은 무덤이다.지상최대공모전 우수상 수상작! 숨막히는 공포 스릴러가 왔다!",9.95,2022.08.24 23:00,TRUE,15세 이용가,TRUE,https://comic.naver.com/webtoon/list?titleId=731930
179704,안나라수마나라,하일권,"스토리, 드라마","따뜻한 감성의 하일권 작가 2010 작품.철없는 마술사를 만난 한 소녀의 성장 드라마.당신, 마술을 믿으시나요?",9.95,2011.01.07 00:08,TRUE,전체연령가,TRUE,https://comic.naver.com/webtoon/list?titleId=179704
754484,안녕 나의 모모로,켄타,"스토리, 감성",전쟁 후 홀로 남은 소년 로이.자신을 챙겨준 고양이 모모로의 죽음을 받아들이지 못하고 헤매는데...외톨이 소년 로이의 가슴 아프지만 따뜻한 이야기,9.98,2021.03.14 23:26,TRUE,전체연령가,TRUE,https://comic.naver.com/webtoon/list?titleId=754484
799267,"안녕, 나의 수집",하린,"에피소드, 일상",슈퍼 '맥시멀리스트'였던 내가 어느 날 '미니멀리즘'에 눈을 떴다?! 이것저것 사 모으는 걸 좋아했던 맥시멀리스트 '무주'.어느 날 포화상태가 된 방을 보고 '이대론 안되겠다'라는 생각이 들었다. 저마다 다양한 사연을 갖고 있는 물건들을 비워내며 미니멀리스트가 되려 하는 무주와 물건의 이야기!,9.95,2022.12.27 23:00,FALSE,전체연령가,FALSE,https://comic.naver.com/webtoon/list?titleId=799267
703633,"안녕, 대학생",다니,"스토리, 로맨스","서른 살, 다시 대학생이 되었습니다.2017 <청춘로맨스 대전> 우수상 수상작",7.95,2019.10.15 23:10,TRUE,전체연령가,TRUE,https://comic.naver.com/webtoon/list?titleId=703633
748532,"안녕, 이바다씨",문나영,"스토리, 로맨스",물이 무서운 여자와 물에 사는 남자의 청량미 넘치는 여름 로맨스!,9.89,2022.08.05 23:00,TRUE,전체연령가,TRUE,https://comic.naver.com/webtoon/list?titleId=748532
787722,안드로이드는 혈이 없어,황동,"스토리, 판타지","차원이동 불시착으로 무협의 세계에 떨어진 가정용 첨단 안드로이드.배고픈 이들에게 음식을 만들어 주면서도 자신은 한 입도 먹지 않고(로봇이라)위험에 처한 사람들을 도우면서도 결코 살생을 하지 않으며(로봇의 3원칙에 따라)결코 잠들지도, 지치지도 않는(로봇이라…) 그 모습에 사람들은 그를 위대한 영웅으로 착각하고그런 안드로이드를 이용해 유명해지려는 무림의 허접 ‘경서’와 무림인들을 둘러싼피와 기름 냄새 가득한 무림 모험기(?)",9.8,2022.01.10 10:00,TRUE,,TRUE,https://comic.naver.com/webtoon/list?titleId=787722
